{
  "contract_version": "1.0",
  "record_type": "decision_operationalization_manifest",
  "owner": "fixture/owner:manifest.json",
  "source_ref": "fixture/owner:manifest.json",
  "source_version": "issuecomment-6003659425",
  "decision_refs": [
    "fixture/owner:manifest.json"
  ],
  "convergence_source": {
    "packet_ref": "disposable_execution_isolation_programstart_convergence_packet.md",
    "packet_hash": "4444444444444444444444444444444444444444444444444444444444444444",
    "coverage_status": "challenged",
    "evidence_refs": [
      "PROGRAMSTART Challenge"
    ]
  },
  "projection_role": "ACTIVE_OPERATIONALIZATION",
  "protected_outcome": "A disposable hostile-code boundary is reconstructable without chat.",
  "obligations": [
    {
      "id": "ISO-01",
      "outcome": "Host feasibility is proven.",
      "owner_ref": "fixture/worker#2",
      "acceptance_refs": [
        "fixture:iso-01"
      ],
      "terminal_refs": [
        "fixture:terminal"
      ],
      "invalidation_triggers": []
    }
  ],
  "planned_steps": [
    {
      "id": "GATE-01",
      "title": "Prove feasibility",
      "outcome_supported": [
        "ISO-01"
      ],
      "owner_ref": "fixture/worker#2",
      "depends_on": [],
      "gate_refs": [
        "GATE-01"
      ],
      "execution_class": "read_only",
      "expected_effect_surface": [
        "execution-node"
      ],
      "acceptance_conditions": [
        "feasibility evidence exists"
      ],
      "stop_conditions": [
        "falsifier fires"
      ]
    }
  ],
  "impact_scope": [
    {
      "object_id": "fixture/worker#2",
      "object_type": "issue",
      "owner_ref": "GrahamArdent/execution-node-control",
      "source_ref": "fixture/owner:manifest.json",
      "impact_type": "host_isolation"
    }
  ],
  "associations": [
    {
      "source": "ISO-01",
      "target": "fixture/worker#2",
      "relation": "OWNED_BY",
      "basis_ref": "fixture/owner:manifest.json",
      "currentness": "CURRENT"
    }
  ],
  "gates": [
    {
      "id": "GATE-01",
      "type": "feasibility",
      "condition": "candidate is evaluated",
      "pass_condition": "requirements satisfied",
      "fail_disposition": "reconsider",
      "owner_ref": "fixture/owner:manifest.json"
    }
  ],
  "falsifiers": [
    {
      "id": "F-01",
      "condition": "boundary cannot contain hostile code",
      "consequence": "evaluate stronger isolation"
    }
  ],
  "exclusions": [
    "generic shell"
  ],
  "non_goals": [
    "second Controller"
  ],
  "constraints": [
    "execution_authority=false"
  ],
  "residuals": [],
  "acceptance_conditions": [
    "cold reconstruction succeeds"
  ],
  "terminal_condition": "protected outcome is independently proven",
  "invalidation_conditions": [
    "owner supersedes the plan"
  ],
  "reconsideration_triggers": [
    "candidate falsified"
  ],
  "coverage": {
    "status": "challenged",
    "method": "independent fixture challenge",
    "evidence_refs": [
      "fixture:coverage"
    ],
    "residuals": []
  },
  "execution_authority": false
}
